{
  "format": "rectamatrix-conformance",
  "vectorVersion": 1,
  "coreVersion": 2,
  "kind": "decoder-positive",
  "vectors": [
    {
      "id": "clean-binary-reference",
      "input": {
        "modules": [
          "111110101010101010101010",
          "111100010111101001111011",
          "110010100011110110011111",
          "110001100101110011100111",
          "100101010100001111010001",
          "010101111011100001001001",
          "101100110100010000000001",
          "010000100001111010010011",
          "100001100101011010001000",
          "000110100000001111100100",
          "110001111110011001010110",
          "010100001000111100001111",
          "100011100101010111101110",
          "011110101010100101011100",
          "100001011010011010011111",
          "010110011110111011110110"
        ]
      },
      "expected": {
        "type": "binary",
        "payloadHex": "0001027f80feff",
        "metadata": {
          "version": 2,
          "sizeId": 0,
          "width": 24,
          "height": 16,
          "eccLevel": "medium",
          "compression": "none",
          "maskId": 3,
          "quality": {
            "profile": "rmx-v2-draft",
            "overallConfidence": 1,
            "averageModuleConfidence": 1,
            "minimumModuleConfidence": 1,
            "anchorScore": 1,
            "topClockScore": 1,
            "leftClockScore": 1,
            "correctedCodewords": 0,
            "erasuresUsed": 0,
            "headerCorrectedCodewords": 0,
            "headerErasuresUsed": 0,
            "decodeAttempts": 2,
            "headerErasureProfile": "reference",
            "bodyErasureProfile": "reference",
            "crcValid": true
          }
        }
      }
    },
    {
      "id": "clean-compressed-utf8-with-detector-metadata",
      "input": {
        "modules": [
          "11111010101010101010101010101010",
          "11111001001111110011010100111010",
          "11000001010010110011001000110101",
          "11000110100100110010100111010111",
          "11110000101010011111101000000011",
          "01001100010101010111001100111101",
          "11001111100110111001000110100101",
          "00110011111001110110001110010010",
          "11000011001110110011110000100110",
          "01001100001111100011110110010010",
          "10001000010000111101001100100011",
          "01011011010100111101101101101111",
          "10111000101001000011110000001110",
          "01110100110110110011011000111100",
          "10001010100110110010101010010011",
          "01011010111101110101001111111010"
        ],
        "confidence": [
          [
            0.8,
            0.8,
            0.8,
            0.8,
            0.8,
            0.8,
            0.8,
            0.8,
            0.8,
            0.8,
            0.8,
            0.8,
            0.8,
            0.8,
            0.8,
            0.8,
            0.8,
            0.8,
            0.8,
            0.8,
            0.8,
            0.8,
            0.8,
            0.8,
            0.8,
            0.8,
            0.8,
            0.8,
            0.8,
            0.8,
            0.8,
            0.8
          ],
          [
            0.8,
            0.8,
            0.8,
            0.8,
            0.8,
            0.8,
            0.8,
            0.8,
            0.8,
            0.8,
            0.8,
            0.8,
            0.8,
            0.8,
            0.8,
            0.8,
            0.8,
            0.8,
            0.8,
            0.8,
            0.8,
            0.8,
            0.8,
            0.8,
            0.8,
            0.8,
            0.8,
            0.8,
            0.8,
            0.8,
            0.8,
            0.8
          ],
          [
            0.8,
            0.8,
            0.8,
            0.8,
            0.8,
            0.8,
            0.8,
            0.8,
            0.8,
            0.8,
            0.8,
            0.8,
            0.8,
            0.8,
            0.8,
            0.8,
            0.8,
            0.8,
            0.8,
            0.8,
            0.8,
            0.8,
            0.8,
            0.8,
            0.8,
            0.8,
            0.8,
            0.8,
            0.8,
            0.8,
            0.8,
            0.8
          ],
          [
            0.8,
            0.8,
            0.8,
            0.8,
            0.8,
            0.8,
            0.8,
            0.8,
            0.8,
            0.8,
            0.8,
            0.8,
            0.8,
            0.8,
            0.8,
            0.8,
            0.8,
            0.8,
            0.8,
            0.8,
            0.8,
            0.8,
            0.8,
            0.8,
            0.8,
            0.8,
            0.8,
            0.8,
            0.8,
            0.8,
            0.8,
            0.8
          ],
          [
            0.8,
            0.8,
            0.8,
            0.8,
            0.8,
            0.8,
            0.8,
            0.8,
            0.8,
            0.8,
            0.8,
            0.8,
            0.8,
            0.8,
            0.8,
            0.8,
            0.8,
            0.8,
            0.8,
            0.8,
            0.8,
            0.8,
            0.8,
            0.8,
            0.8,
            0.8,
            0.8,
            0.8,
            0.8,
            0.8,
            0.8,
            0.8
          ],
          [
            0.8,
            0.8,
            0.8,
            0.8,
            0.8,
            0.8,
            0.8,
            0.8,
            0.8,
            0.8,
            0.8,
            0.8,
            0.8,
            0.8,
            0.8,
            0.8,
            0.8,
            0.8,
            0.8,
            0.8,
            0.8,
            0.8,
            0.8,
            0.8,
            0.8,
            0.8,
            0.8,
            0.8,
            0.8,
            0.8,
            0.8,
            0.8
          ],
          [
            0.8,
            0.8,
            0.8,
            0.8,
            0.8,
            0.8,
            0.8,
            0.8,
            0.8,
            0.8,
            0.8,
            0.8,
            0.8,
            0.8,
            0.8,
            0.8,
            0.8,
            0.8,
            0.8,
            0.8,
            0.8,
            0.8,
            0.8,
            0.8,
            0.8,
            0.8,
            0.8,
            0.8,
            0.8,
            0.8,
            0.8,
            0.8
          ],
          [
            0.8,
            0.8,
            0.8,
            0.8,
            0.8,
            0.8,
            0.8,
            0.8,
            0.8,
            0.8,
            0.8,
            0.8,
            0.8,
            0.8,
            0.8,
            0.8,
            0.8,
            0.8,
            0.8,
            0.8,
            0.8,
            0.8,
            0.8,
            0.8,
            0.8,
            0.8,
            0.8,
            0.8,
            0.8,
            0.8,
            0.8,
            0.8
          ],
          [
            0.8,
            0.8,
            0.8,
            0.8,
            0.8,
            0.8,
            0.8,
            0.8,
            0.8,
            0.8,
            0.8,
            0.8,
            0.8,
            0.8,
            0.8,
            0.8,
            0.8,
            0.8,
            0.8,
            0.8,
            0.8,
            0.8,
            0.8,
            0.8,
            0.8,
            0.8,
            0.8,
            0.8,
            0.8,
            0.8,
            0.8,
            0.8
          ],
          [
            0.8,
            0.8,
            0.8,
            0.8,
            0.8,
            0.8,
            0.8,
            0.8,
            0.8,
            0.8,
            0.8,
            0.8,
            0.8,
            0.8,
            0.8,
            0.8,
            0.8,
            0.8,
            0.8,
            0.8,
            0.8,
            0.8,
            0.8,
            0.8,
            0.8,
            0.8,
            0.8,
            0.8,
            0.8,
            0.8,
            0.8,
            0.8
          ],
          [
            0.8,
            0.8,
            0.8,
            0.8,
            0.8,
            0.8,
            0.8,
            0.8,
            0.8,
            0.8,
            0.8,
            0.8,
            0.8,
            0.8,
            0.8,
            0.8,
            0.8,
            0.8,
            0.8,
            0.8,
            0.8,
            0.8,
            0.8,
            0.8,
            0.8,
            0.8,
            0.8,
            0.8,
            0.8,
            0.8,
            0.8,
            0.8
          ],
          [
            0.8,
            0.8,
            0.8,
            0.8,
            0.8,
            0.8,
            0.8,
            0.8,
            0.8,
            0.8,
            0.8,
            0.8,
            0.8,
            0.8,
            0.8,
            0.8,
            0.8,
            0.8,
            0.8,
            0.8,
            0.8,
            0.8,
            0.8,
            0.8,
            0.8,
            0.8,
            0.8,
            0.8,
            0.8,
            0.8,
            0.8,
            0.8
          ],
          [
            0.8,
            0.8,
            0.8,
            0.8,
            0.8,
            0.8,
            0.8,
            0.8,
            0.8,
            0.8,
            0.8,
            0.8,
            0.8,
            0.8,
            0.8,
            0.8,
            0.8,
            0.8,
            0.8,
            0.8,
            0.8,
            0.8,
            0.8,
            0.8,
            0.8,
            0.8,
            0.8,
            0.8,
            0.8,
            0.8,
            0.8,
            0.8